{
  "id": "connor-mako-sullivan-kairos-lol-academy-blue",
  "slug": "connor-mako-sullivan-kairos-lol-academy-blue",
  "continuityId": "kairos-universe",
  "playerId": "connor-mako-sullivan",
  "organizationId": "kairos-esports",
  "teamId": "kairos-lol-academy-blue",
  "gameId": "game-league-of-legends",
  "roleId": "role-top",
  "rosterStatus": "active",
  "isCaptain": false,
  "isStarter": true,
  "joinedDate": "TBD",
  "leftDate": null,
  "datePrecision": "unknown",
  "announcementDate": "TBD",
  "effectiveDate": "TBD",
  "endReason": null,
  "sourceIds": [
    "source-player-connor-mako-sullivan",
    "source-team-kairos-lol-academy-blue"
  ],
  "canonStatus": "confirmed"
}
